{
  "schema": "ni.session.v0",
  "active_planning_focus": "Measure resolved internal-dashboard benchmark artifact readiness",
  "last_planning_summary": "User answers for OQ-001 through OQ-004 were applied as benchmark planning-meeting artifact readiness, not dashboard product readiness. The workspace now records resolved OQs, explicit scope boundaries, acceptance criteria, privacy constraints, and non-execution limits before measuring readiness with ni status.",
  "pending_questions": [],
  "recent_decisions": [
    {
      "id": "DEC-001",
      "title": "Treat the dashboard request as planning evidence, not build scope.",
      "status": "accepted"
    },
    {
      "id": "DEC-002",
      "title": "Use the benchmark workspace only for ni CLI readiness proof.",
      "status": "accepted"
    },
    {
      "id": "DEC-003",
      "title": "Scope readiness to the benchmark planning artifact.",
      "status": "accepted"
    },
    {
      "id": "DEC-004",
      "title": "Keep approval role explicit even when the named person is unassigned.",
      "status": "accepted"
    }
  ],
  "recent_risks": [
    {
      "id": "RISK-001",
      "title": "A downstream actor could treat benchmark artifact answers as dashboard implementation requirements.",
      "severity": "high",
      "status": "accepted"
    },
    {
      "id": "RISK-002",
      "title": "Sensitive data could be copied into the benchmark packet or evidence files.",
      "severity": "high",
      "status": "accepted"
    },
    {
      "id": "RISK-003",
      "title": "Meeting-readiness ranking could hide acceptance-critical gaps.",
      "severity": "high",
      "status": "accepted"
    },
    {
      "id": "RISK-004",
      "title": "The resolved benchmark case could be falsely presented as product-readiness evidence.",
      "severity": "high",
      "status": "accepted"
    }
  ],
  "last_readiness_status": "READY",
  "last_readiness_blockers": [],
  "last_updated_docs": [
    "docs/plan/00_project_brief.md",
    "docs/plan/01_actors_outcomes.md",
    "docs/plan/02_capabilities.md",
    "docs/plan/03_interaction_contract.md",
    "docs/plan/04_domain_state.md",
    "docs/plan/05_constraints.md",
    "docs/plan/06_risks_security.md",
    "docs/plan/07_evaluation_contract.md",
    "docs/plan/08_delivery_operation.md",
    "docs/plan/09_execution_strategy.md",
    "docs/plan/10_open_questions.md",
    "docs/plan/11_decision_log.md",
    ".ni/contract.json"
  ],
  "authority_order": [
    ".ni/plan.lock.json",
    ".ni/contract.json",
    "docs/plan/**",
    ".ni/session.json",
    "chat history"
  ],
  "notes": {
    "planning_aid_only": "Session state is a planning aid, not authority.",
    "locked_docs": "Session state must not override locked docs.",
    "completion": "Session state must not mark docs complete.",
    "raw_transcript": "Raw transcript is not the source of truth."
  }
}
