{
  "schema": "ni.session.v0",
  "active_planning_focus": "Ready for ni-end confirmation after conversation resolved the blocker policy-source question.",
  "last_planning_summary": "The model-maintained docs and contract describe a refund triage assistant that drafts recommendations only, escalates ambiguity, and uses the internal refund policy page as authority. ni status reports READY_WITH_DEFERRALS because DEC-004 and OQ-002 remain visible but non-blocking under the prototype profile.",
  "pending_questions": [
    {
      "id": "OQ-002",
      "title": "Which support dashboard will eventually display the recommendation draft?",
      "blocker": false
    }
  ],
  "recent_decisions": [
    {
      "id": "DEC-001",
      "title": "Treat the internal refund policy page as the authoritative eligibility source.",
      "status": "accepted"
    },
    {
      "id": "DEC-003",
      "title": "Use human-team as the first downstream prompt target after lock.",
      "status": "accepted"
    },
    {
      "id": "DEC-004",
      "title": "Final production owner for maintaining the refund policy page.",
      "status": "deferred"
    }
  ],
  "recent_risks": [
    {
      "id": "RISK-001",
      "title": "The assistant may imply refund approval authority that belongs to humans or payment systems.",
      "severity": "high",
      "status": "accepted"
    },
    {
      "id": "RISK-003",
      "title": "A stale or unclear policy page could create incorrect refund recommendations.",
      "severity": "high",
      "status": "accepted"
    }
  ],
  "last_readiness_status": "READY_WITH_DEFERRALS",
  "last_readiness_blockers": [],
  "last_updated_docs": [
    "docs/plan/00_project_brief.md",
    "docs/plan/01_actors_outcomes.md",
    "docs/plan/02_capabilities.md",
    "docs/plan/03_interaction_contract.md",
    "docs/plan/04_domain_state.md",
    "docs/plan/05_constraints.md",
    "docs/plan/06_risks_security.md",
    "docs/plan/07_evaluation_contract.md",
    "docs/plan/08_delivery_operation.md",
    "docs/plan/09_execution_strategy.md",
    "docs/plan/10_open_questions.md",
    "docs/plan/11_decision_log.md",
    ".ni/contract.json",
    ".ni/session.json"
  ],
  "authority_order": [
    ".ni/plan.lock.json",
    ".ni/contract.json",
    "docs/plan/**",
    ".ni/session.json",
    "chat history"
  ],
  "notes": {
    "planning_aid_only": "Session state is a planning aid, not authority.",
    "locked_docs": "Session state must not override locked docs.",
    "completion": "Session state must not mark docs complete.",
    "raw_transcript": "Raw transcript is not the source of truth."
  }
}
